{
  "schema_version": "controlled-contract-pack-parameter-contract.v1",
  "profile_id": "proof.operation.forbidden-noninvocation",
  "profile_version": "4.0.0",
  "profile_digest": "d33c7c3eb034b334d4bcda5705c3334a98e408ecf91663b03bab81b60058956d",
  "description": "For one caller-declared subject operation, one declared execution context, and one complete exact nonempty forbidden-operation population, the subject does not use any forbidden member in that context; one verification reads the exact subject, context, population, and every forbidden member, verifies that prohibition, and carries same-subject, same-context positive use of the same complete population as its falsifier.",
  "parameters": [
    {
      "name": "subject_operation",
      "purpose": "Declare subject operation for proof.operation.forbidden-noninvocation. Preserve every linked refinement and applicability; this identifies a semantic referent, not an observed truth or generated graph ID.",
      "value_kind": "typed_referent",
      "roles": [
        "subject_operation"
      ],
      "refinement_refs": [
        "/reference_roles/0"
      ],
      "applicability_refs": [
        "/claim_patterns/0",
        "/claim_patterns/1",
        "/claim_patterns/2",
        "/distinct_reference_role_sets/0"
      ],
      "source": {
        "policy": "configurable",
        "default": null,
        "mapping": null
      }
    },
    {
      "name": "execution_context",
      "purpose": "Declare execution context for proof.operation.forbidden-noninvocation. Preserve every linked refinement and applicability; this identifies a semantic referent, not an observed truth or generated graph ID.",
      "value_kind": "typed_referent",
      "roles": [
        "execution_context"
      ],
      "refinement_refs": [
        "/reference_roles/1"
      ],
      "applicability_refs": [
        "/claim_patterns/0",
        "/claim_patterns/1",
        "/claim_patterns/2",
        "/distinct_reference_role_sets/0",
        "/falsifier_condition_bindings/0",
        "/reference_binding_patterns/0"
      ],
      "source": {
        "policy": "configurable",
        "default": null,
        "mapping": null
      }
    },
    {
      "name": "forbidden_operation_population",
      "purpose": "Declare forbidden operation population for proof.operation.forbidden-noninvocation. Preserve every linked refinement and applicability; this identifies a semantic referent, not an observed truth or generated graph ID.",
      "value_kind": "complete_population",
      "roles": [
        "forbidden_operation_population"
      ],
      "refinement_refs": [
        "/reference_roles/2"
      ],
      "applicability_refs": [
        "/claim_patterns/1",
        "/claim_patterns/2",
        "/distinct_reference_role_sets/0",
        "/reference_binding_patterns/0"
      ],
      "source": {
        "policy": "configurable",
        "default": null,
        "mapping": null
      }
    },
    {
      "name": "forbidden_operations",
      "purpose": "Declare forbidden operations for proof.operation.forbidden-noninvocation. Preserve every linked refinement and applicability; this identifies a semantic referent, not an observed truth or generated graph ID.",
      "value_kind": "complete_population",
      "roles": [
        "forbidden_operations"
      ],
      "refinement_refs": [
        "/reference_roles/3"
      ],
      "applicability_refs": [
        "/claim_patterns/0",
        "/claim_patterns/1",
        "/claim_patterns/2",
        "/reference_binding_patterns/0"
      ],
      "source": {
        "policy": "configurable",
        "default": null,
        "mapping": null
      }
    },
    {
      "name": "verification",
      "purpose": "Declare verification for proof.operation.forbidden-noninvocation. Preserve every linked refinement and applicability; this identifies a semantic referent, not an observed truth or generated graph ID.",
      "value_kind": "typed_referent",
      "roles": [
        "verification"
      ],
      "refinement_refs": [
        "/reference_roles/4"
      ],
      "applicability_refs": [
        "/claim_patterns/1",
        "/claim_patterns/2",
        "/distinct_reference_role_sets/0"
      ],
      "source": {
        "policy": "configurable",
        "default": null,
        "mapping": null
      }
    }
  ],
  "role_producers": [
    {
      "role": "subject_operation",
      "kind": "semantic_parameter",
      "parameter": "subject_operation",
      "inputs": [],
      "rule_refs": [
        "/claim_patterns/0",
        "/claim_patterns/1",
        "/claim_patterns/2",
        "/distinct_reference_role_sets/0"
      ],
      "capability": null,
      "gap": null
    },
    {
      "role": "execution_context",
      "kind": "semantic_parameter",
      "parameter": "execution_context",
      "inputs": [],
      "rule_refs": [
        "/claim_patterns/0",
        "/claim_patterns/1",
        "/claim_patterns/2",
        "/distinct_reference_role_sets/0",
        "/falsifier_condition_bindings/0",
        "/reference_binding_patterns/0"
      ],
      "capability": null,
      "gap": null
    },
    {
      "role": "forbidden_operation_population",
      "kind": "semantic_parameter",
      "parameter": "forbidden_operation_population",
      "inputs": [],
      "rule_refs": [
        "/claim_patterns/1",
        "/claim_patterns/2",
        "/distinct_reference_role_sets/0",
        "/reference_binding_patterns/0"
      ],
      "capability": null,
      "gap": null
    },
    {
      "role": "forbidden_operations",
      "kind": "semantic_parameter",
      "parameter": "forbidden_operations",
      "inputs": [],
      "rule_refs": [
        "/claim_patterns/0",
        "/claim_patterns/1",
        "/claim_patterns/2",
        "/reference_binding_patterns/0"
      ],
      "capability": null,
      "gap": null
    },
    {
      "role": "verification",
      "kind": "semantic_parameter",
      "parameter": "verification",
      "inputs": [],
      "rule_refs": [
        "/claim_patterns/1",
        "/claim_patterns/2",
        "/distinct_reference_role_sets/0"
      ],
      "capability": null,
      "gap": null
    }
  ],
  "construction": {
    "capability": "construction",
    "semantic_inputs": [
      "subject_operation",
      "execution_context",
      "forbidden_operation_population",
      "forbidden_operations",
      "verification"
    ],
    "declaration_outputs": [],
    "required_observations": [],
    "canonical_inputs": []
  },
  "dependencies": {
    "state": "unresolved",
    "gap": {
      "owner": "@agent-chassis/controlled-contract",
      "missing": "No authored exact inter-pack dependency recipe for proof.operation.forbidden-noninvocation.",
      "source": "lib/proof-authoring-skeleton.mjs",
      "consequence": "Do not infer independent construction or supporting packs; WK-2553 must retain this unresolved construction fact."
    }
  },
  "capabilities": [
    {
      "id": "construction",
      "kind": "constructor",
      "state": "unavailable",
      "identity": null,
      "evidence": "lib/proof-authoring-skeleton.mjs: general binding assistance requires an existing populated native contract.",
      "evidence_kind": "static",
      "gap": {
        "owner": "@agent-chassis/controlled-contract",
        "missing": "No named proof.operation.forbidden-noninvocation constructor maps semantic inputs to the complete native graph.",
        "source": "lib/proof-authoring-skeleton.mjs",
        "consequence": "WK-2553 must report unavailable construction; binding by compatible type does not establish a source mapping."
      },
      "implementation_version": null
    },
    {
      "id": "canonical-source",
      "kind": "canonical_resolver",
      "state": "declared_requirement",
      "identity": null,
      "evidence": "WK-2553 owns canonical instance source resolution; metadata does not resolve a WK.",
      "evidence_kind": "requirement",
      "gap": null,
      "implementation_version": null
    },
    {
      "id": "observation",
      "kind": "observation_acquisition",
      "state": "unavailable",
      "identity": null,
      "evidence": "lib/verification-profile-runtime.mjs validates bound declarations; it is not a general observation acquisition provider.",
      "evidence_kind": "static",
      "gap": {
        "owner": "@agent-chassis/controlled-contract",
        "missing": "No general observation acquisition mapping for proof.operation.forbidden-noninvocation.",
        "source": "lib/verification-profile-runtime.mjs",
        "consequence": "Required observations remain unavailable until their actual owner supplies acquired evidence."
      },
      "implementation_version": null
    },
    {
      "id": "evaluation",
      "kind": "evaluation",
      "state": "implemented",
      "identity": "@agent-chassis/controlled-contract#evaluateVerificationProfileV1",
      "evidence": "lib/verification-profile-v1.mjs: incumbent exact profile evaluation; certification is distinct from implementation truth.",
      "evidence_kind": "static",
      "gap": null,
      "implementation_version": "1.0.0"
    }
  ]
}
