{
  "schema_version": "controlled-contract-pack-parameter-contract.v1",
  "profile_id": "proof.verification.test-validity",
  "profile_version": "12.0.0",
  "profile_digest": "c78f901ccce27e8e72732078dd0c268d76efdf41ca7292fc8f2062fb32f449e3",
  "description": "For one exact test_execution proof instance, complete launcher-authenticated runtime evidence bound to the exact candidate or source snapshot, controlled-contract generation, obligation, proof-plan entry, declared target, test-proof binding, admitted profile, certification, guarantee, and evaluator satisfies the guarantee only when the candidate passes, the one test the binding's declarative test selector names is discovered, executed, and not skipped, every declared falsifier is present, every falsifier the provider could apply is detected, every required traversal is present and proven, and no prohibited shortcut is observed. A falsifier the provider could not apply is an authenticated capability limitation: it earns no detection credit, is not counterevidence, and never excuses a surviving sibling. A supported, isolated, actually observed mutation that leaves the selected test passing falsifies the guarantee; for a passing candidate, an incomplete falsifier population or a supported falsifier that is neither detected nor such a survivor is not executable, and a failed candidate gains no mutation counterevidence from its falsifier rows. No authored baseline inventory participates, and sibling tests observed in the same run neither earn nor withhold credit. Complete valid negative inventory or execution facts falsify the guarantee; missing evidence or an unavailable exact evaluator is not executable; malformed, unauthenticated, stale, ambiguous, cross-bound, contradictory, or digest-mismatched evidence is refused. This is a bounded execution-validity guarantee. It preserves the caller's requirement, verification and falsification meanings unchanged; it does not establish that assertions faithfully test those meanings. Passing execution, detected dependency mutations and module traversal grant no requirement-satisfaction credit. Assertion-to-requirement behavioral adequacy is not established by this mechanism.",
  "parameters": [],
  "role_producers": [],
  "construction": {
    "capability": "construction",
    "semantic_inputs": [],
    "declaration_outputs": [],
    "required_observations": [],
    "canonical_inputs": []
  },
  "dependencies": {
    "state": "complete",
    "packs": []
  },
  "capabilities": [
    {
      "id": "construction",
      "kind": "constructor",
      "state": "unavailable",
      "identity": null,
      "evidence": "lib/native-test-proof-authoring.mjs applies a native case to existing authored requirements. This metadata does not construct requirement meaning or a behavioral graph pattern.",
      "evidence_kind": "static",
      "gap": {
        "owner": "@agent-chassis/controlled-contract",
        "missing": "This execution definition supplies no generic requirement-meaning constructor.",
        "source": "lib/native-test-proof-authoring.mjs",
        "consequence": "Author the native case against the unchanged requirement; authenticated execution is acquired separately by workspace_verify_proof."
      },
      "implementation_version": null
    },
    {
      "id": "canonical-source",
      "kind": "canonical_resolver",
      "state": "declared_requirement",
      "identity": null,
      "evidence": "WK-2553 canonical test declaration and work-record-test-proof-bindings.mjs own the test target and exact selector.",
      "evidence_kind": "requirement",
      "gap": null,
      "implementation_version": null
    },
    {
      "id": "observation",
      "kind": "observation_acquisition",
      "state": "declared_requirement",
      "identity": null,
      "evidence": "workspace_verify_proof acquires authenticated execution observations through the shared runner and native providers; authored planning witnesses cannot supply them.",
      "evidence_kind": "requirement",
      "gap": null,
      "implementation_version": null
    },
    {
      "id": "evaluation",
      "kind": "evaluation",
      "state": "implemented",
      "identity": "@agent-chassis/controlled-contract#resolveExactProofEvaluator",
      "evidence": "lib/proof-evaluator-registry.mjs resolves the exact authenticated execution evaluator. Definition assessment reports execution pending and grants no behavioral credit.",
      "evidence_kind": "static",
      "gap": null,
      "implementation_version": "1.0.0"
    }
  ]
}
